{
  "artifact_id": "artifact_audio_scene_01_v1",
  "artifact_type": "speech",
  "config_hash": "3b732827d3067c4965bf37e239d39635a86a110e0632b8898634c29ff0270e42",
  "created_at": "2026-10-21T12:01:00Z",
  "input_artifact_ids": [
    "artifact_script_v1"
  ],
  "logical_slot": "speech_scene_01",
  "media_metadata": {
    "channels": 2,
    "sample_rate": 48000
  },
  "media_type": "audio/wav",
  "producer_attempt_id": "attempt_speech_01",
  "producer_version": "local-speech-fixture.v1",
  "retention_class": "intermediate",
  "run_id": "run_01",
  "schema_version": "artifact.v1",
  "sha256": "4ed6f358f380ce6f51fb126f947d8a251bf3f40b7e970c902b9e5fec45dad512",
  "size_bytes": 48000,
  "state": "ACCEPTED",
  "uri": "artifact://run_01/speech_scene_01/v1.wav",
  "version": 1
}
